{
  "schema_version": "fabricctl.support-manifest/v1",
  "created_at": "2026-08-28T10:15:00Z",
  "generator": {"version": "0.7.1", "commit": "0123456789abcdef"},
  "files": [
    {
      "path": "environment.json",
      "class": "allowlisted-runtime-identity",
      "sha256": "dddddddddddddddddddddddddddddddddddddddddddddddddddddddddddddddd"
    }
  ],
  "excluded": ["raw prompts and responses", "credentials and tokens", "Kubernetes Secrets"],
  "uploaded": false,
  "bundle_digest": "sha256:eeeeeeeeeeeeeeeeeeeeeeeeeeeeeeeeeeeeeeeeeeeeeeeeeeeeeeeeeeeeeeee"
}
